Name,Name,List name,Edition,Edition code,Collector's number,Price,Price (total),Foil,QuantityX,Tag,Language,Condition,Rarity,Card Type,CMC,Mana Cost,Card Rulings,MultiverseID,Card Text,Power,Toughness,Loyalty,Currency,Scryfall ID,TCGPlayer productID,Edition (code),Edition [code],Foil quantity,Quantity
"Mystic Forge","Mystic Forge","Johira","Core Set 2020","M20","233","US$ 5.00","5","","1x","","","","R","Artifact","4","{4}","""• Mystic Forge lets you look at the top card of your library whenever you want (with one restriction—see below), even if you don’t have priority. This action doesn’t use the stack. Knowing what that card is becomes part of the information you have access to, just like you can look at the cards in your hand.
• If the top card of your library changes while you’re casting a spell, playing a land, or activating an ability, you can’t look at the new top card until you finish doing so. This means that if you cast the top card of your library, you can’t look at the next one until you’re done paying for that spell.
• You must follow the normal timing permissions and restrictions of the spells you cast from your library.
• You still pay all costs for a spell you cast from your library, including additional costs. You may also pay alternative costs.
• Because you never “cast” a land card, Mystic Forge doesn’t allow you to play an artifact land from the top of your library.
• If the top card of your library has a morph ability, you can cast it face down from the top of your library, even if it’s normally not a colorless card.""","466987","""You may look at the top card of your library any time.
You may cast the top card of your library if it's an artifact card or a colorless nonland card.
{T}, Pay 1 life: Exile the top card of your library.""","0","0","0","USD","924a24e7-91b8-4ceb-a136-7a765d98c994","192786","(m20)","[m20]","0","1"
"Strionic Resonator","Strionic Resonator","Johira","Masters 25","A25","232","US$ 2.93","2.93","","1x","","","","R","Artifact","2","{2}","""• Triggered abilities use the word “when,” “whenever,” or “at.” They’re often written as “[Trigger condition], [effect].”
• Strionic Resonator targets a triggered ability that has triggered and is on the stack and creates another instance of that ability on the stack. It doesn’t cause any object to gain an ability.
• The source of the copy is the same as the source of the original ability.
• If the triggered ability is modal (that is, if it says, “Choose one —” or similar), the mode is copied and can’t be changed.
• If the triggered ability divides damage or distributes counters among a number of targets (for example, the ability of Bogardan Hellkite), the division and number of targets can’t be changed. If you choose new targets, you must choose the same number of targets.
• Any choices made when the triggered ability resolves won’t have been made yet when it’s copied. Any such choices will be made separately when the copy resolves. If the triggered ability asks you to pay a cost (such as that of Frenzied Goblin), you pay that cost for the copy.
• If a triggered ability is linked to a second ability, copies of that triggered ability are also linked to that second ability. If the second ability refers to “the exiled card,” it refers to all cards exiled by the triggered ability and the copy. For example, if Fiend Hunter’s enters-the-battlefield ability is copied and two creatures are exiled, they both return when Fiend Hunter leaves the battlefield.
• In some cases involving linked abilities, an ability requires information about “the exiled card.” When this happens, the ability gets multiple answers. If these answers are being used to determine the value of a variable, the sum is used. For example, if Elite Arcanist’s enters-the-battlefield ability is copied, two cards are exiled. The value of X in the activation cost of Elite Arcanist’s other ability is the sum of the two cards’ converted mana costs. As the ability resolves, you create copies of both cards and can cast none, one, or both of the copies in any order.""","442221","""{2}, {T}: Copy target triggered ability you control. You may choose new targets for the copy. (A triggered ability uses the words ""when,"" ""whenever,"" or ""at."")""","0","0","0","USD","3ccbd2c4-ffe0-4992-88d9-5be1adb3bda6","161489","(a25)","[a25]","0","1"
"Weatherlight","Weatherlight","Johira","Dominaria","DOM","237","US$ 0.75","0.75","","1x","","","","M","Legendary Artifact — Vehicle","4","{4}","""• A card, spell, or permanent is historic if it has the legendary supertype, the artifact card type, or the Saga subtype. Having two of those qualities doesn’t make an object more historic than another or provide an additional bonus—an object either is historic or it isn’t.""","443125","""Flying
Whenever Weatherlight deals combat damage to a player, look at the top five cards of your library. You may reveal a historic card from among them and put it into your hand. Put the rest on the bottom of your library in a random order. (Artifacts, legendaries, and Sagas are historic.)
Crew 3""","4","5","0","USD","d4581fc0-551c-4ee5-bde0-65c2b8cdf1b7","164100","(dom)","[dom]","0","1"
"Tolaria West","Tolaria West","Johira","From the Vault: Lore","V16","13","US$ 15.79","15.79","Foil","1x","","","","M","Land","0","","""• Cards with mana cost {0} (like Pact of Negation) and cards with no mana cost (like Living End and every land) have converted mana cost 0.""","416755","""Tolaria West enters the battlefield tapped.
{T}: Add {U}.
Transmute {1}{U}{U} ({1}{U}{U}, Discard this card: Search your library for a card with converted mana cost 0, reveal it, and put it into your hand. Then shuffle your library. Transmute only as a sorcery.)""","0","0","0","USD","7adede7f-ee9b-48b7-98cb-9672d36e8a0c","121180","(v16)","[v16]","1","1"
"Fabricate","Fabricate","Johira","Magic 2010","M10","52","US$ 4.89","4.89","","1x","","","","U","Sorcery","3","{2}{U}","""""","189876","""Search your library for an artifact card, reveal it, and put it into your hand. Then shuffle your library.""","0","0","0","USD","6f75d8c9-c15d-4474-9d3f-d35f49e46477","32609","(m10)","[m10]","0","1"
"Tezzeret, Artifice Master","Tezzeret, Artifice Master","Johira","Core Set 2019","M19","79","US$ 5.16","5.16","","1x","","","","M","Legendary Planeswalker — Tezzeret","5","{3}{U}{U}","""• If you put a permanent onto the battlefield with Tezzeret’s emblem’s ability, any triggered abilities of that permanent that trigger during your end step won’t trigger during that same end step.""","447215","""+1: Create a 1/1 colorless Thopter artifact creature token with flying.
0: Draw a card. If you control three or more artifacts, draw two cards instead.
−9: You get an emblem with ""At the beginning of your end step, search your library for a permanent card, put it onto the battlefield, then shuffle your library.""""","0","0","5","USD","e5e12371-f05c-41cf-92ca-7cb17c2f7f1a","169355","(m19)","[m19]","0","1"
"Echo Storm","Echo Storm","Johira","Commander 2018","C18","7","US$ 0.63","0.63","","1x","","","","R","Sorcery","5","{3}{U}{U}","""• If you have multiple commanders (for example, because they have Partner), this spell counts the total number of times you have cast all of them this game. For more information, see https://twitter.com/GavinVerhey/status/1039255476276355073
• Each copy resolves one at a time. Any abilities that trigger on the artifact token entering the battlefield resolve before the next copy resolves. The original spell is the last to resolve.
• The token copies exactly what was printed on the original artifact and nothing else (unless that artifact is copying something else or is a token; see below). It doesn’t copy whether that artifact is tapped or untapped, whether it has any counters on it or Auras attached to it, or any non-copy effects that have changed its types, color, or so on.
• If the copied artifact has {X} in its mana cost, X is considered to be 0.
• If the copied artifact is a token, the token that’s created copies the original characteristics of that token as stated by the effect that created the token.
• If the copied artifact is copying something else (for example, if the copied artifact is a Sculpting Steel), then the token enters the battlefield as whatever that artifact copied.
• Any enters-the-battlefield abilities of the copied artifact will trigger when the token enters the battlefield. Any “as [this artifact] enters the battlefield” or “[this artifact] enters the battlefield with” abilities of the chosen artifact will also work.
• Each Storm’s triggered ability counts only how many times you’ve cast your commander from the command zone before that triggered ability resolves. If you cast your commander again later, you won’t get another copy.
• If your commander was countered, that time you cast it still counts.
• Each Storm’s triggered ability can copy the Storm spell even if that spell is countered before that ability resolves.
• The copies are created on the stack, so they’re not “cast.” Abilities that trigger when a player casts a spell (such as the Storm’s ability itself) won’t trigger.""","450608","""When you cast this spell, copy it for each time you've cast your commander from the command zone this game. You may choose new targets for the copies.
Create a token that's a copy of target artifact.""","0","0","0","USD","546da0df-db26-4f50-8b5e-eb09782dd1d1","170795","(c18)","[c18]","0","1"
"Desolate Lighthouse","Desolate Lighthouse","Johira","Avacyn Restored","AVR","227","US$ 0.80","0.8","","1x","","","","R","Land","0","","""""","240147","""{T}: Add {C}.
{1}{U}{R}, {T}: Draw a card, then discard a card.""","0","0","0","USD","16fb45bc-6152-4b01-9831-a8e80b1c1852","58299","(avr)","[avr]","0","1"
"Foundry of the Consuls","Foundry of the Consuls","Johira","Magic Origins","ORI","247","US$ 0.25","0.25","","1x","","","","U","Land","0","","""""","398613","""{T}: Add {C}.
{5}, {T}, Sacrifice Foundry of the Consuls: Create two 1/1 colorless Thopter artifact creature tokens with flying.""","0","0","0","USD","73f29e03-0a71-46cd-992e-7baa61f16ac5","100328","(ori)","[ori]","0","1"
"Sea Gate Wreckage","Sea Gate Wreckage","Johira","Oath of the Gatewatch","OGW","177","US$ 0.50","0.5","","1x","","","","R","Land","0","","""• It doesn’t matter how many cards are in your hand as the last ability resolves. For example, if you have no cards in hand and control two Sea Gate Wreckages, you can activate the last ability of each of them. You’ll draw a card as each ability resolves.""","407687","""{T}: Add {C}. ({C} represents colorless mana.)
{2}{C}, {T}: Draw a card. Activate this ability only if you have no cards in hand.""","0","0","0","USD","cd42576b-9de5-4d77-9d30-1ef5b5a4fd73","110802","(ogw)","[ogw]","0","1"
"Arch of Orazca","Arch of Orazca","Johira","Rivals of Ixalan","RIX","185","US$ 1.13","1.13","","1x","","","","R","Land","0","","""• Once you have the city’s blessing, you have it for the rest of the game, even if you lose control of some or all of your permanents. The city’s blessing isn’t a permanent itself and can’t be removed by any effect.
• A permanent is any object on the battlefield, including tokens and lands. Spells and emblems aren’t permanents.
• If you cast a spell with ascend, you don’t get the city’s blessing until it resolves. Players may respond to that spell by trying to change whether you get the city’s blessing.
• If you control ten permanents but don’t control a permanent or resolving spell with ascend, you don’t get the city’s blessing. For example, if you control ten permanents, lose control of one, then cast Golden Demise, you won’t have the city’s blessing and the spell will affect creatures you control.
• If your tenth permanent enters the battlefield and then a permanent leaves the battlefield immediately afterwards (most likely due to the “Legend Rule” or due to being a creature with 0 toughness), you get the city’s blessing before it leaves the battlefield.
• Ascend on a permanent isn’t a triggered ability and doesn’t use the stack. Players can respond to a spell that will give you your tenth permanent, but they can’t respond to getting the city’s blessing once you control that tenth permanent. This means that if your tenth permanent is a land you play, players can’t respond before you get the city’s blessing.""","439849","""Ascend (If you control ten or more permanents, you get the city's blessing for the rest of the game.)
{T}: Add {C}.
{5}, {T}: Draw a card. Activate this ability only if you have the city's blessing.""","0","0","0","USD","c6d47162-749b-47d5-9589-8f1dbf60b9f3","155675","(rix)","[rix]","0","1"
"Ash Barrens","Ash Barrens","Johira","Commander Anthology Volume II","CM2","235","US$ 3.09","3.09","","1x","","","","C","Land","0","","""""","446971","""{T}: Add {C}.
Basic landcycling {1} ({1}, Discard this card: Search your library for a basic land card, reveal it, put it into your hand, then shuffle your library.)""","0","0","0","USD","a3c2eb06-5124-417f-b2f7-b05f0f658b47","166726","(cm2)","[cm2]","0","1"
"Mountain","Mountain","Johira","Kaladesh","KLD","261","US$ 0.51","1.02","Foil","2x","","","","C","Basic Land — Mountain","0","","""""","417834","""({T}: Add {R}.)""","0","0","0","USD","56b65f77-85c1-49cd-bb2e-70e5225ace9a","122789","(kld)","[kld]","1","2"
"Island","Island","Johira","Duel Decks: Elspeth vs. Tezzeret","DDF","76","US$ 0.22","0.22","Foil","1x","","","","C","Basic Land — Island","0","","""""","222725","""({T}: Add {U}.)""","0","0","0","USD","0b9dbac5-56e5-4054-9b58-7fa5de30487d","83136","(ddf)","[ddf]","1","1"
"Island","Island","Johira","Duel Decks: Izzet vs. Golgari","DDJ","39","US$ 0.19","0.19","Foil","1x","","","","C","Basic Land — Island","0","","""""","292763","""({T}: Add {U}.)""","0","0","0","USD","0ba4f2b6-d802-44c7-8a4d-4e5b26a26292","77336","(ddj)","[ddj]","1","1"
"Opal Palace","Opal Palace","Johira","Commander 2013","C13","310","US$ 0.65","0.65","","1x","","","","C","Land","0","","""• The “number of times it’s been cast from the command zone” includes the most recent time. For example, the first time you cast your commander from the command zone in a game, if you spent mana from Opal Palace’s last ability to do so, it will enter the battlefield with a +1/+1 counter.
• The color identity of your commander is set before the game begins and doesn’t change during the game, even if your commander is in a hidden zone (like the hand or library) or an effect changes your commander’s color.
• If your commander is a card like Kozilek, Butcher of Truth that has no colors in its color identity, Opal Palace’s last ability produces no mana.
• In formats other than Commander, Opal Palace’s last ability produces no mana.""","376438","""{T}: Add {C}.
{1}, {T}: Add one mana of any color in your commander's color identity. If you spend this mana to cast your commander, it enters the battlefield with a number of additional +1/+1 counters on it equal to the number of times it's been cast from the command zone this game.""","0","0","0","USD","e8b912d9-5682-4462-954a-b4c2eb1aebbb","71894","(c13)","[c13]","0","1"
"Mountain","Mountain","Johira","Mirrodin","MRD","300","US$ 0.76","0.76","Foil","1x","","","","C","Basic Land — Mountain","0","","""""","48418","""({T}: Add {R}.)""","0","0","0","USD","4399a832-4406-4a12-a5e5-81744d02ceec","18437","(mrd)","[mrd]","1","1"
"Island","Island","Johira","Duel Decks: Venser vs. Koth","DDI","41","US$ 0.18","0.18","Foil","1x","","","","C","Basic Land — Island","0","","""""","284491","""({T}: Add {U}.)""","0","0","0","USD","5d301d65-e81b-4750-bd26-9a6e5e386dc5","58082","(ddi)","[ddi]","1","1"
"Thopter Spy Network","Thopter Spy Network","Johira","Magic Origins","ORI","79","US$ 2.27","2.27","Foil","1x","","","","R","Enchantment","4","{2}{U}{U}","""• Thopter Spy Network’s first ability has an “intervening ‘if’ clause.” That means (1) the ability won’t trigger at all unless you control an artifact as your upkeep begins, and (2) the ability will do nothing if you don’t control an artifact as it resolves.
• The last ability will trigger, at most, once per combat damage step. However, if at least one artifact creature you control has first strike and others don’t, or if an artifact creature you control has double strike, the ability could trigger twice per combat: once in each combat damage step.""","398519","""At the beginning of your upkeep, if you control an artifact, create a 1/1 colorless Thopter artifact creature token with flying.
Whenever one or more artifact creatures you control deal combat damage to a player, draw a card.""","0","0","0","USD","5516d86e-539a-4ba8-8d25-1a3b27b1267a","100248","(ori)","[ori]","1","1"
"Pia and Kiran Nalaar","Pia and Kiran Nalaar","Johira","Magic Origins","ORI","157","US$ 0.63","0.63","","1x","","","","R","Legendary Creature — Human Artificer","4","{2}{R}{R}","""""","398453","""When Pia and Kiran Nalaar enters the battlefield, create two 1/1 colorless Thopter artifact creature tokens with flying.
{2}{R}, Sacrifice an artifact: Pia and Kiran Nalaar deals 2 damage to any target.""","2","2","0","USD","0dcafa9e-3637-42ca-bdb2-45a2b5da7294","100014","(ori)","[ori]","0","1"
"Mishra's Factory","Mishra's Factory","Johira","Duel Decks: Elspeth vs. Tezzeret","DDF","73","US$ 0.76","0.76","","1x","","","","U","Land","0","","""• Once turned into a creature, Mishra’s Factory’s last ability can target itself. If it’s already blocking, this won’t remove it from combat.
• If you turn Mishra’s Factory into a creature but haven’t controlled it continuously since your most recent turn began, you won’t be able to activate its first or last ability.
• Activating the ability that turns it into a creature while it’s already a creature will override any effects that set its power and/or toughness to a specific number. However, any effect that raises or lowers power and/or toughness (such as the effect created by Giant Growth, Glorious Anthem, or a +1/+1 counter) will continue to apply.
• A noncreature permanent that turns into a creature can attack, and its {T} abilities can be activated, only if its controller has continuously controlled that permanent since the beginning of their most recent turn. It doesn’t matter how long the permanent has been a creature.
• If another player takes control of the Factory while it is animated, that player keeps control until the control effect ends. They do not lose control just because the card stops being an Assembly-Worker. Note that Auras which steal cards will go to the graveyard if the permanent they enchant is no longer valid.""","218340","""{T}: Add {C}.
{1}: Mishra's Factory becomes a 2/2 Assembly-Worker artifact creature until end of turn. It's still a land.
{T}: Target Assembly-Worker creature gets +1/+1 until end of turn.""","0","0","0","USD","ade01a16-65f1-4b50-ab9a-98e9bbf9f57d","36957","(ddf)","[ddf]","0","1"
"Mind Stone","Mind Stone","Johira","Duel Decks: Zendikar vs. Eldrazi","DDP","65","US$ 1.03","1.03","","1x","","","","U","Artifact","2","{2}","""""","401707","""{T}: Add {C}.
{1}, {T}, Sacrifice Mind Stone: Draw a card.""","0","0","0","USD","0eebe138-f638-4e8a-820e-ecdada7cc586","104250","(ddp)","[ddp]","0","1"
"Mirage Mirror","Mirage Mirror","Johira","Hour of Devastation","HOU","165","US$ 2.78","2.78","","1x","","","","R","Artifact","3","{3}","""• Once Mirage Mirror’s ability resolves, it no longer has that ability.
• Mirage Mirror copies the printed values of the target permanent, plus any copy effects that have been applied to it. It won’t copy counters on that permanent or effects that have changed its power, toughness, types, color, or so on. Notably, it won’t copy effects that made the target permanent become a creature.
• If Mirage Mirror copies a permanent that’s copying something else, it will become whatever the target is copying.
• If you activate Mirage Mirror’s ability multiple times in a turn in response to itself, then each time one of those abilities resolves, it will overwrite whatever Mirage Mirror is copying. Mirage Mirror will wind up as a copy of the permanent targeted by the last ability to resolve. When the turn ends, all instances of the ability will wear off at the same time.
• If an effect begins to apply to Mirage Mirror before it becomes a copy of another permanent, that effect will continue to apply. For example, if Mirage Mirror is activated twice in response to itself targeting first Rampaging Hippo then Frilled Sandwalla, the ability it has while it’s a copy of Frilled Sandwalla can be activated and its effect will continue to apply while Mirage Mirror is a copy of Rampaging Hippo.
• If Mirage Mirror becomes a creature the same turn it enters the battlefield, you can’t attack with it or use any of its {T} abilities (if it gains any) unless it has haste.
• If Mirage Mirror becomes a copy of a legendary permanent you control, you’ll put one of them into your graveyard.
• If Mirage Mirror becomes a copy of an Aura, it’s put into its owner’s graveyard unless it’s somehow attached to an appropriate object or player already. If it becomes a copy of an Equipment and is attached to a creature, it’ll become unattached when it becomes a non-Equipment artifact again.""","430854","""{2}: Mirage Mirror becomes a copy of target artifact, creature, enchantment, or land until end of turn.""","0","0","0","USD","29148d7e-b398-4e19-a29e-d9a660ad5016","134930","(hou)","[hou]","0","1"
"Smuggler's Copter","Smuggler's Copter","Johira","Kaladesh Promos","PKLD","235s","US$ 6.67","6.67","Foil","1x","","","","R","Artifact — Vehicle","2","{2}","""• Each Vehicle is printed with a power and toughness, but it’s not a creature. If it becomes a creature (most likely through its crew ability), it will have that power and toughness.
• If an effect causes a Vehicle to become an artifact creature with a specified power and toughness, that effect overwrites the Vehicle’s printed power and toughness.
• Vehicle is an artifact type, not a creature type. A Vehicle that’s crewed won’t normally have any creature type.
• Once a player announces that they are activating a crew ability, no player may take other actions until the ability has been paid for. Notably, players can’t try to stop the ability by changing a creature’s power or by removing or tapping a creature.
• Any untapped creature you control can be tapped to pay a crew cost, even one that just came under your control.
• You may tap more creatures than necessary to activate a crew ability.
• Creatures that crew a Vehicle aren’t attached to it or related in any other way. Effects that affect the Vehicle, such as by destroying it or giving it a +1/+1 counter, don’t affect the creatures that crewed it.
• Once a Vehicle becomes a creature, it behaves exactly like any other artifact creature. It can’t attack unless you’ve controlled it continuously since your turn began, it can block if it’s untapped, it can be tapped to pay a Vehicle’s crew cost, and so on.
• You may activate a crew ability of a Vehicle even if it’s already an artifact creature. Doing so has no effect on the Vehicle. It doesn’t change its power and toughness.
• For a Vehicle to be able to attack, it must be a creature as the declare attackers step begins, so the latest you can activate its crew ability to attack with it is during the beginning of combat step. For a Vehicle to be able to block, it must be a creature as the declare blockers step begins, so the latest you can activate its crew ability to block with it is during the declare attackers step. In either case, players may take actions after the crew ability resolves but before the Vehicle has been declared as an attacking or blocking creature.
• When a Vehicle becomes a creature, that doesn’t count as having a creature enter the battlefield. The permanent was already on the battlefield; it only changed its types. Abilities that trigger whenever a creature enters the battlefield won’t trigger.
• If a permanent becomes a copy of a Vehicle, the copy won’t be a creature, even if the Vehicle it’s copying has become an artifact creature.""","0","""Flying
Whenever Smuggler's Copter attacks or blocks, you may draw a card. If you do, discard a card.
Crew 1 (Tap any number of creatures you control with total power 1 or more: This Vehicle becomes an artifact creature until end of turn.)""","3","3","0","USD","b91248e8-9d00-4d42-a05a-21a009204404","123401","(pkld)","[pkld]","1","1"
"Memory Jar","Memory Jar","Johira","Urza's Legacy","ULG","129","US$ 22.04","22.04","","1x","","","","R","Artifact","5","{5}","""• You can’t look at the cards you exiled until they return to your hand.""","8841","""{T}, Sacrifice Memory Jar: Each player exiles all cards from their hand face down and draws seven cards. At the beginning of the next end step, each player discards their hand and returns to their hand each card they exiled this way.""","0","0","0","USD","a15d33d6-7213-4482-a1be-ac0a73644af6","6341","(ulg)","[ulg]","0","1"
"Gilded Lotus","Gilded Lotus","Johira","Mirrodin","MRD","175","US$ 4.92","4.92","","1x","Proxy","","","R","Artifact","5","{5}","""""","48189","""{T}: Add three mana of any one color.""","0","0","0","USD","a1d5e4c8-dfd0-45bc-8000-ebfaccfefec3","11489","(mrd)","[mrd]","0","1"
