Name,Name,List name,Edition,Edition code,Collector's number,Price,Price (total),Foil,QuantityX,Tag,Language,Condition,Rarity,Card Type,CMC,Mana Cost,Card Rulings,MultiverseID,Card Text,Power,Toughness,Loyalty,Currency,Scryfall ID,TCGPlayer productID,Edition (code),Edition [code],Foil quantity,Quantity
"Mechanized Production","Mechanized Production","Johira","Aether Revolt","AER","38","US$ 3.92","3.92","","1x","","","","M","Enchantment — Aura","4","{2}{U}{U}","""• Any abilities that trigger on the token being created won’t resolve until after Mechanized Production’s triggered ability has finished resolving entirely and performed its check for eight artifacts with the same name.
• The eight artifacts with the same name don’t have to have the same name as the enchanted artifact. For example, you win the game if you control eight Thopter artifact creature tokens as Mechanized Production’s ability resolves, even if Mechanized Production isn’t attached to a Thopter.
• All eight of the permanents sharing a name must be artifacts. If you control only seven artifacts with the same name and a nonartifact permanent with that same name, you won’t win the game.
• If you control eight or more artifacts that share a name while you control Mechanized Production, you won’t win the game yet. You’ll win the game while resolving its triggered ability during your upkeep.
• The token copies exactly what was printed on the original artifact and nothing else (unless that artifact is copying something else or is a token; see below). It doesn’t copy whether that artifact is tapped or untapped, whether it has any counters on it or Auras attached to it, or any non-copy effects that have changed its types, color, or so on.
• If the copied artifact has {X} in its mana cost, X is considered to be zero.
• If the copied artifact is copying something else (for example, if the copied artifact is a Sculpting Steel), then the token enters the battlefield as whatever that artifact copied.
• If the copied artifact is a token, the token that’s created copies the original characteristics of that token as stated by the effect that created it.
• Any enters-the-battlefield abilities of the copied artifact trigger when the artifact token enters the battlefield. The artifact token also has any “this enters the battlefield with” or “as this enters the battlefield” abilities that the copied artifact has.
• If Mechanized Production and the enchanted artifact leave the battlefield simultaneously in response to the triggered ability, then the effect creates a token that’s a copy of the artifact as it last existed on the battlefield.
• If the enchanted artifact leaves the battlefield in response to Mechanized Production’s triggered ability but Mechanized Production does not, Mechanized Production is put into its owner’s graveyard as a state-based action with no enchanted artifact. The triggered ability creates no token, but you can still win the game if you control enough artifacts with the same name.""","423705","""Enchant artifact you control
At the beginning of your upkeep, create a token that's a copy of enchanted artifact. Then if you control eight or more artifacts with the same name as one another, you win the game.""","0","0","0","USD","235dd8f1-215a-4b0a-9e94-0d0d5a3c730b","126349","(aer)","[aer]","0","1"
"Seat of the Synod","Seat of the Synod","Johira","Mirrodin","MRD","283","US$ 0.88","0.88","","1x","","","","C","Artifact Land","0","","""""","46064","""(Seat of the Synod isn't a spell.)
{T}: Add {U}.""","0","0","0","USD","5da5587d-6b6c-4645-8cc9-2866d1e6911b","11310","(mrd)","[mrd]","0","1"
"Talisman of Creativity","Talisman of Creativity","Johira","Modern Horizons","MH1","231","US$ 0.87","0.87","","1x","","","","U","Artifact","2","{2}","""""","464180","""{T}: Add {C}.
{T}: Add {U} or {R}. Talisman of Creativity deals 1 damage to you.""","0","0","0","USD","4d9dbadd-c1b6-44fe-92ac-6f69d7178342","191060","(mh1)","[mh1]","0","1"
"Mox Amber","Mox Amber","Johira","Dominaria","DOM","224","US$ 25.00","25","","1x","","","","M","Legendary Artifact","0","{0}","""• Mox Amber’s ability adds one mana of the color of your choice from among the colors of legendary creatures and planeswalkers you control. It doesn’t add one mana of each of those colors.
• If you control no legendary creatures or planeswalkers, you can activate Mox Amber’s ability, but you won’t add any mana.
• If your legendary creatures and planeswalkers are all colorless, you can activate Mox Amber’s ability, but you won’t add any mana. Colorless is not a color.""","443112","""{T}: Add one mana of any color among legendary creatures and planeswalkers you control.""","0","0","0","USD","66024e69-ad60-4c9a-a0ca-da138d33ad80","162125","(dom)","[dom]","0","1"
"Chrome Mox","Chrome Mox","Johira","Mirrodin","MRD","152","US$ 39.09","39.09","","1x","Proxy","","","R","Artifact","0","{0}","""• If no card is imprinted on Chrome Mox, it can’t add mana to your mana pool. It can never add colorless mana to your mana pool, even if the imprinted card has a colorless mana symbol in its mana cost.
• If you imprinted a multicolored card, you choose one of that card’s colors each time Chrome Mox’s ability resolves.""","47446","""Imprint — When Chrome Mox enters the battlefield, you may exile a nonartifact, nonland card from your hand.
{T}: Add one mana of any of the exiled card's colors.""","0","0","0","USD","6a058e68-70af-4a64-859c-c881e5578368","11467","(mrd)","[mrd]","0","1"
"Thran Dynamo","Thran Dynamo","Johira","Iconic Masters","IMA","230","US$ 5.54","5.54","","1x","","","","U","Artifact","4","{4}","""""","438796","""{T}: Add {C}{C}{C}.""","0","0","0","USD","508a8735-642c-4f22-bbd9-4a189d93e7b7","145452","(ima)","[ima]","0","1"
"Rings of Brighthearth","Rings of Brighthearth","Johira","Kaladesh Inventions","MPS","21","US$ 123.25","123.25","Foil","1x","","","","M","Artifact","3","{3}","""• A mana ability is an ability that (1) isn’t a loyalty ability, (2) doesn’t target, and (3) could put mana into a player’s mana pool when it resolves.""","420608","""Whenever you activate an ability, if it isn't a mana ability, you may pay {2}. If you do, copy that ability. You may choose new targets for the copy.""","0","0","0","USD","3c7c38ea-a1a4-47dd-9d73-a84872b57736","122858","(mps)","[mps]","1","1"
"Paradox Engine","Paradox Engine","Johira","Kaladesh Inventions","MPS","43","US$ 90.08","90.08","Foil","1x","","","","M","Legendary Artifact","5","{5}","""• Paradox Engine’s triggered ability resolves before the spell that caused it to trigger. The ability will resolve even if that spell is countered.""","425814","""Whenever you cast a spell, untap all nonland permanents you control.""","0","0","0","USD","9d9f95de-547f-4c1f-a14c-87dc022af398","126306","(mps)","[mps]","1","1"
"Temporal Aperture","Temporal Aperture","Johira","Urza's Saga","USG","310","US$ 5.32","5.32","","1x","","","","R","Artifact","2","{2}","""• While you do not have to pay the mana cost, you do have to pay any other costs described in the text that are paid when playing the card. If the cost in the card text is optional, such as with Buyback, you can optionally pay that cost.
• If your library is shuffled or that card otherwise leaves the top of your library, the effect ends.
• The card is removed from the top of the library when you play it, just like a card is removed from your hand when you play it.""","5548","""{5}, {T}: Shuffle your library, then reveal the top card. Until end of turn, for as long as that card remains on top of your library, play with the top card of your library revealed and you may play that card without paying its mana cost. (If it has X in its mana cost, X is 0.)""","0","0","0","USD","5b5c2555-c707-4814-933a-c275b9ebc0a3","7066","(usg)","[usg]","0","1"
"Saheeli, Sublime Artificer","Saheeli, Sublime Artificer","Johira","War of the Spark","WAR","234","US$ 0.75","0.75","","1x","","","","U","Legendary Planeswalker — Saheeli","3","{1}{U/R}{U/R}","""• Saheeli’s first ability resolves before the spell that caused it to trigger. It resolves even if that spell is countered.
• Saheeli’s loyalty ability causes the target artifact to copy the printed values of the target permanent, plus any copy effects that have been applied to it. It won’t copy counters on that permanent or effects that have changed its power, toughness, types, color, or so on. Notably, it won’t copy effects that made the target permanent become a creature.
• The target artifact is an artifact in addition to whatever types the second target has, and this exception is copiable. If something else copies the artifact later in the turn, that copy also will be an artifact.
• If the target artifact copies a permanent that’s copying something else, it will become whatever the target is copying.
• If an effect begins to apply to the target artifact before it becomes a copy of another permanent, that effect will continue to apply.
• If the target artifact becomes a creature the same turn it enters the battlefield, you can’t attack with it or use any of its {T} abilities unless it has haste.
• If the target artifact isn’t an Equipment and becomes a copy of an Equipment, it’ll become unattached when it becomes a non-Equipment artifact again.
• If the target artifact is an Equipment attached to a creature and it becomes a copy of a non-Equipment permanent, it becomes unattached. If it becomes a copy of an Equipment, it remains attached.""","461161","""Whenever you cast a noncreature spell, create a 1/1 colorless Servo artifact creature token.
−2: Target artifact you control becomes a copy of another target artifact or creature you control until end of turn, except it's an artifact in addition to its other types.""","0","0","5","USD","5a10b543-d5d4-42a8-9ee8-dada59a2ad7e","188352","(war)","[war]","0","1"
"Nevinyrral's Disk","Nevinyrral's Disk","Johira","From the Vault: Relics","V10","11","US$ 4.27","4.27","Foil","1x","","","","M","Artifact","4","{4}","""• You don’t sacrifice Nevinyrral’s Disk to activate its ability. It’s destroyed as part of the ability’s resolution if it’s still on the battlefield. If an effect gives Nevinyrral’s Disk indestructible or regenerates it, it stays on the battlefield.""","212637","""Nevinyrral's Disk enters the battlefield tapped.
{1}, {T}: Destroy all artifacts, creatures, and enchantments.""","0","0","0","USD","52cb8c89-d8f3-4879-8ef7-a954b09ddce5","36766","(v10)","[v10]","1","1"
"Island","Island","Johira","Amonkhet","AKH","251","US$ 3.00","9","Foil","3x","","","","C","Basic Land — Island","0","","""""","426953","""({T}: Add {U}.)""","0","0","0","USD","bec6fced-62bb-4a99-9ea1-374056b5781b","129687","(akh)","[akh]","1","3"
"Basalt Monolith","Basalt Monolith","Johira","Commander 2015","C15","244","US$ 3.13","3.13","","1x","","","","U","Artifact","3","{3}","""• It can be untapped as often as you can pay for it.""","405139","""Basalt Monolith doesn't untap during your untap step.
{T}: Add {C}{C}{C}.
{3}: Untap Basalt Monolith.""","0","0","0","USD","e5951ebc-8fee-4305-a776-b2bd751c9818","108079","(c15)","[c15]","0","1"
"Tawnos, Urza's Apprentice","Tawnos, Urza's Apprentice","Johira","Commander 2018","C18","45","US$ 1.13","1.13","Foil","1x","","","","M","Legendary Creature — Human Artificer","2","{U}{R}","""• Activated abilities contain a colon. They’re generally written “[Cost]: [Effect].” Some keyword abilities (such as equip) are activated abilities and will have colons in their reminder text. An activated mana ability is one that produces mana as it resolves, not one that costs mana to activate.
• Triggered abilities use the word “when,” “whenever,” or “at.” They’re often written as “[Trigger condition], [effect].” Some keyword abilities are triggered abilities and will have “when,” “whenever,” or “at the beginning of” in their reminder text.
• Tawnos’s ability targets an ability that is on the stack and creates another instance of that ability on the stack. It doesn’t cause any object to gain an ability.
• An “artifact source” is a permanent, spell, or card in any zone with the card type “artifact.” For example, Tawnos’s ability can target a cycling ability you’ve activated if the discarded card is an artifact card.
• The source of the copy is the same as the source of the original ability.
• If the ability is modal (that is, if it says, “Choose one —” or similar), the mode is copied and can’t be changed.
• If the ability divides damage or distributes counters among a number of targets (for example, the ability of Verdurous Gearhulk), the division and number of targets can’t be changed. If you choose new targets, you must choose the same number of targets.
• If the activated ability’s cost contains a choice, such as a creature to sacrifice or a number of counters to remove, the copy uses that same information. You can’t pay the cost again, even if you want to.
• Any choices made when the ability resolves won’t have been made yet when it’s copied. Any such choices will be made separately when the copy resolves. If a triggered ability asks you to pay a cost (such as that of Mirrorworks), you pay that cost for the copy separately.
• If an ability is linked to a second ability, copies of that ability are also linked to that second ability. If the second ability refers to “the exiled card,” it refers to all cards exiled by the ability and the copy. For example, if Tidehollow Sculler’s enters-the-battlefield ability is copied and two cards are exiled, they both return when Tidehollow Sculler leaves the battlefield.
• In some cases involving linked abilities, an ability requires information about “the exiled card.” When this happens, the ability gets multiple answers. If these answers are being used to determine the value of a variable, the sum is used. For example, if Soul Foundry’s enters-the-battlefield ability is copied, two cards are exiled. The value of X in the activation cost of Soul Foundry’s other ability is the sum of the two cards’ converted mana costs. As the ability resolves, you create a token copy of each card.""","450646","""Haste
{U}{R}, {T}: Copy target activated or triggered ability you control from an artifact source. You may choose new targets for the copy. (Mana abilities can't be targeted.)""","1","3","0","USD","a031a6c1-d7d1-4980-ac8e-30440ff4408f","170803","(c18)","[c18]","1","1"
"Steel Hellkite","Steel Hellkite","Johira","Scars of Mirrodin Promos","PSOM","205","US$ 2.41","2.41","Foil","1x","","","","R","Artifact Creature — Dragon","6","{6}","""• If a nonland permanent has no mana symbols in its upper right corner (because it’s a token that’s not copying of something else, for example), its converted mana cost is 0.
• Steel Hellkite’s last ability destroys only nonland permanents whose converted mana cost is exactly equal to X, and only those controlled by players who have been dealt combat damage by Steel Hellkite this turn.
• It doesn’t matter who controlled those permanents at the time Steel Hellkite dealt combat damage, or if those permanents were even on the battlefield at that time.
• You may activate the last ability even if Steel Hellkite hasn’t dealt combat damage to any players that turn. If you do, the ability won’t do anything.
• If Steel Hellkite’s third ability is activated with X equal to 0, it will destroy each nonland permanent with converted mana cost 0 the appropriate players control.
• The converted mana cost of a permanent is determined solely by the mana symbols printed in its upper right corner, unless it’s copying something else (see below). The converted mana cost is the total amount of mana in that cost, regardless of color. For example, a card with mana cost {3}{U}{U} has converted mana cost 5.
• If a permanent is copying something else, its converted mana cost is the converted mana cost of whatever it’s copying.
• In all cases, ignore any alternative costs or additional costs (such as kicker) paid when the permanent was cast.
• If the mana cost of a permanent includes {X}, X is considered to be 0.""","0","""Flying
{2}: Steel Hellkite gets +1/+0 until end of turn.
{X}: Destroy each nonland permanent with converted mana cost X whose controller was dealt combat damage by Steel Hellkite this turn. Activate this ability only once each turn.""","5","5","0","USD","b268cd3b-af91-4c22-ac73-347babb69200","38291","(psom)","[psom]","1","1"
"Spellskite","Spellskite","Johira","New Phyrexia","NPH","159","US$ 10.10","10.1","","1x","","","","R","Artifact Creature — Horror","2","{2}","""• You can activate Spellskite’s ability even if Spellskite wouldn’t be a legal target for the spell or ability. However, the target of that spell or ability will remain unchanged.
• If changing one target of a spell or ability to Spellskite would make other targets of that spell or ability illegal, the targets remain unchanged.
• If the spell or ability has multiple instances of the word “target,” you choose which target you’re changing to Spellskite when Spellskite’s ability resolves.
• By activating Spellskite’s ability multiple times, you can change each target of a spell or ability with multiple instances of the word “target” to Spellskite, one at a time.
• The target of the spell or ability won’t change unless Spellskite fulfills all the targeting criteria, even if multiple instances of the word “target” are used. For example, you can’t change both targets of Arc Trail to Spellskite.
• If a spell or ability has multiple targets but doesn’t use the word “target” multiple times, such as Fulgent Distraction, you can only successfully change one of the targets to Spellskite.
• If a spell or ability has a variable number of targets, you can’t change the number of targets.
• If Spellskite leaves the battlefield before its ability resolves, the targets remain unchanged.""","217992","""{U/P}: Change a target of target spell or ability to Spellskite. ({U/P} can be paid with either {U} or 2 life.)""","0","4","0","USD","1a84bada-ed6a-4e97-8a0c-05b7cb32d66f","39431","(nph)","[nph]","0","1"
"Terramorphic Expanse","Terramorphic Expanse","Johira","Commander 2014","C14","315","US$ 0.25","0.25","","1x","","","","C","Land","0","","""""","389716","""{T}, Sacrifice Terramorphic Expanse: Search your library for a basic land card, put it onto the battlefield tapped, then shuffle your library.""","0","0","0","USD","9f045684-345f-4e76-a19c-4a66e8279844","94216","(c14)","[c14]","0","1"
"Goblin Engineer","Goblin Engineer","Johira","Modern Horizons","MH1","128","US$ 3.12","3.12","","1x","","","","R","Creature — Goblin Artificer","2","{1}{R}","""• Because targets are chosen for activated abilities before costs (such as “Sacrifice an artifact”) are paid, Goblin Engineer’s second ability can’t target the artifact that will be sacrificed to pay its cost.""","464077","""When Goblin Engineer enters the battlefield, you may search your library for an artifact card, put it into your graveyard, then shuffle your library.
{R}, {T}, Sacrifice an artifact: Return target artifact card with converted mana cost 3 or less from your graveyard to the battlefield.""","1","2","0","USD","a55c4d47-5252-40af-961d-c08bc688028a","190867","(mh1)","[mh1]","0","1"
"Mox Tantalite","Mox Tantalite","Johira","Modern Horizons","MH1","226","US$ 5.04","5.04","","1x","","","","M","Artifact","0","","""• Mox Tantalite has no mana cost. You can’t cast it unless an effect (such as that of suspend) allows you to cast it for an alternative cost or without paying its mana cost. Its converted mana cost is 0.
• You can exile a card in your hand using suspend any time you could cast that card. Consider its card type, any effect that affects when you could cast it, and any other effects that could stop you from casting it to determine if and when you can do this. Whether or not you could actually complete all steps in casting the card is irrelevant. For example, you can exile a card with suspend that has no mana cost or requires a target even if no legal targets are available at that time.
• Exiling a card with suspend isn’t casting that card. This action doesn’t use the stack and can’t be responded to.
• After removing the last time counter, you must cast the card if able. Timing permissions based on the card’s type are ignored. If an effect prohibits you from casting the card, it remains exiled with no time counters on it, and it’s no longer suspended.""","464175","""Suspend 3—{0} (Rather than cast this card from your hand, pay {0} and exile it with three time counters on it. At the beginning of your upkeep, remove a time counter. When the last is removed, cast it without paying its mana cost.)
{T}: Add one mana of any color.""","0","0","0","USD","dcd05b01-dc73-4dd2-970a-32ec6e153c86","190981","(mh1)","[mh1]","0","1"
"Platinum Angel","Platinum Angel","Johira","From the Vault: Angels","V15","13","US$ 6.19","6.19","Foil","1x","","","","M","Artifact Creature — Angel","7","{7}","""• No game effect can cause you to lose the game or cause any opponent to win the game while you control Platinum Angel. It doesn’t matter whether you have 0 or less life, you’re forced to draw a card while your library is empty, you have ten or more poison counters, you’re dealt combat damage by Phage the Untouchable, your opponent has Mortal Combat with twenty or more creature cards in their graveyard, or so on. You keep playing.
• Other circumstances can still cause you to lose the game, however. You will lose a game if you concede, if you’re penalized with a Game Loss or a Match Loss during a sanctioned tournament due to a DCI rules infraction, or if your _Magic Online_(R) game clock runs out of time.
• If you control Platinum Angel in a Two-Headed Giant game, your team can’t lose the game and the opposing team can’t win the game.
• Effects that say the game is a draw, such as the _Legends_(TM) card Divine Intervention, are not affected by Platinum Angel. They’ll still work.
• You can concede a game while Platinum Angel on the battlefield. A concession causes you to leave the game, which then causes you to lose the game (Once you concede, you no longer control a Platinum Angel, so its ability can’t prevent you from losing the game).""","401640","""Flying
You can't lose the game and your opponents can't win the game.""","4","4","0","USD","4e5780f1-f561-415f-99e3-907447d8280e","102785","(v15)","[v15]","1","1"
"Darksteel Colossus","Darksteel Colossus","Johira","Darksteel","DST","109","US$ 7.81","7.81","","1x","","","","R","Artifact Creature — Golem","11","{11}","""• Lethal damage, damage from a source with deathtouch, and effects that say “destroy” won’t cause a creature with indestructible to be put into the graveyard. However, a creature with indestructible can be put into the graveyard for a number of reasons. The most likely reasons are if it’s sacrificed or if its toughness is 0 or less. (In these cases, of course, Darksteel Colossus would be shuffled into its owner’s library instead of being put into its owner’s graveyard.)""","48158","""Trample, indestructible
If Darksteel Colossus would be put into a graveyard from anywhere, reveal Darksteel Colossus and shuffle it into its owner's library instead.""","11","11","0","USD","cbc27b24-f085-48b0-8757-cd11fbf25b91","11624","(dst)","[dst]","0","1"
"Duplicant","Duplicant","Johira","Commander 2018","C18","205","US$ 1.95","1.95","","1x","","","","R","Artifact Creature — Shapeshifter","6","{6}","""• If a melded permanent is exiled by Duplicant’s triggered ability, that ability’s controller chooses the relative timestamp of the two meld cards. Duplicant looks at the information of the one with the later timestamp.
• If no creature card is imprinted on Duplicant, it has its normal power, toughness, and creature type.
• Duplicant’s base power and toughness change to the imprinted card’s power and toughness. Counters and other effects that modify Duplicant’s power and toughness still apply.
• Abilities that define a creature’s power and toughness apply while that card is in exile, but abilities that add or subtract from it don’t. For example, the ability of Battle Squadron applies to determine Duplicant’s power and toughness, but the ability of Werebear doesn’t. Duplicant’s power and toughness are constantly updated if the exiled card’s power and/or toughness change.
• Duplicant keeps all creature types it had when the card was imprinted, including any types that Duplicant had gained.""","451160","""Imprint — When Duplicant enters the battlefield, you may exile target nontoken creature.
As long as a card exiled with Duplicant is a creature card, Duplicant has the power, toughness, and creature types of the last creature card exiled with Duplicant. It's still a Shapeshifter.""","2","4","0","USD","ea87504f-b373-448b-8444-46fdc3d93250","171122","(c18)","[c18]","0","1"
"Arcum Dagsson","Arcum Dagsson","Johira","Coldsnap","CSP","27","US$ 28.19","28.19","","1x","","","","R","Legendary Creature — Human Artificer","4","{3}{U}","""• Arcum Dagsson’s ability targets an artifact creature, not the controller of one.
• Arcum Dagsson’s ability can target any permanent that’s both an artifact and a creature, such as a Grizzly Bears while Mycosynth Lattice is on the battlefield.""","122124","""{T}: Target artifact creature's controller sacrifices it. That player may search their library for a noncreature artifact card, put it onto the battlefield, then shuffle their library.""","2","2","0","USD","dd9d3ce7-53db-4808-88bc-03c120211f81","14000","(csp)","[csp]","0","1"
