Name,Name,List name,Edition,Edition code,Collector's number,Price,Price (total),Foil,QuantityX,Tag,Language,Condition,Rarity,Card Type,CMC,Mana Cost,Card Rulings,MultiverseID,Card Text,Power,Toughness,Loyalty,Currency,Scryfall ID,TCGPlayer productID,Edition (code),Edition [code],Foil quantity,Quantity
"Jori En, Ruin Diver","Jori En, Ruin Diver","Johira","Oath of the Gatewatch Promos","POGW","155","US$ 2.05","2.05","Foil","1x","","","","R","Legendary Creature — Merfolk Wizard","3","{1}{U}{R}","""• Jori En’s ability can trigger only once each turn. The ability will resolve before the second spell resolves. It doesn’t matter if the first spell you cast that turn has resolved, was countered, or is still on the stack.
• Jori En must be on the battlefield in order for the ability to function. Notably, the ability won’t trigger if Jori En is the second spell you cast in a turn.""","0","""Whenever you cast your second spell each turn, draw a card.""","2","3","0","USD","2e002ba5-b028-484a-8832-0a904df4bb36","110835","(pogw)","[pogw]","1","1"
"Tribute Mage","Tribute Mage","Johira","Modern Horizons","MH1","73","US$ 0.40","0.4","","1x","","","","U","Creature — Human Wizard","3","{2}{U}","""• If a card in your library has X in its mana cost, X is considered to be 0.""","464022","""When Tribute Mage enters the battlefield, you may search your library for an artifact card with converted mana cost 2, reveal that card, put it into your hand, then shuffle your library.""","2","2","0","USD","6c180888-6acd-401b-815a-6ed434482681","191210","(mh1)","[mh1]","0","1"
"Pia Nalaar","Pia Nalaar","Johira","Kaladesh","KLD","124","US$ 0.36","0.36","","1x","","","","R","Legendary Creature — Human Artificer","3","{2}{R}","""• Once a creature has blocked an attacking creature, activating Pia Nalaar’s last ability won’t cause the attacking creature to become unblocked.
• The “legend rule” cares about legendary permanents with the exact same English name. The Kaladesh™ card Pia Nalaar and the Magic Origins™ card Pia and Kiran Nalaar have different names, so you can control both at the same time.""","417697","""When Pia Nalaar enters the battlefield, create a 1/1 colorless Thopter artifact creature token with flying.
{1}{R}: Target artifact creature gets +1/+0 until end of turn.
{1}, Sacrifice an artifact: Target creature can't block this turn.""","2","2","0","USD","6a2b2954-0734-4219-b6df-c6cc3dcd8d5a","122665","(kld)","[kld]","0","1"
"Mirrodin Besieged","Mirrodin Besieged","Johira","Modern Horizons","MH1","57","US$ 0.68","0.68","","1x","","","","R","Enchantment","3","{2}{U}","""• If you support the Mirrans, Mirrodin Besieged’s ability resolves before the spell that caused it to trigger. It resolves even if that spell is countered.
• If you support the Phyrexians, you must choose a target opponent as your end step begins. Whether that player loses the game is determined only as the ability resolves. This means that the card you discard may be the fifteenth artifact card that causes the target player to lose the game, but it also means that if there is no legal target opponent, you won’t draw or discard.
• If you somehow control Mirrodin Besieged and no choice was made for it, it has neither of the two triggered abilities.
• In a Two-Headed Giant game, if one player on a team loses the game, that team loses the game.""","464006","""As Mirrodin Besieged enters the battlefield, choose Mirran or Phyrexian.
• Mirran — Whenever you cast an artifact spell, create a 1/1 colorless Myr artifact creature token.
• Phyrexian — At the beginning of your end step, draw a card, then discard a card. Then if there are fifteen or more artifact cards in your graveyard, target opponent loses the game.""","0","0","0","USD","d8423d8d-744a-4bbe-a853-8ad756451bdb","191559","(mh1)","[mh1]","0","1"
"Goblin Welder","Goblin Welder","Johira","Commander Anthology Volume II","CM2","101","US$ 1.41","1.41","","1x","","","","R","Creature — Goblin Artificer","1","{R}","""• As the new wording makes clear, both targets must still be legal as the ability resolves in order for it to do anything. If either one or both has become illegal, nothing gets sacrificed and nothing gets returned to the battlefield.""","446837","""{T}: Choose target artifact a player controls and target artifact card in that player's graveyard. If both targets are still legal as this ability resolves, that player simultaneously sacrifices the artifact and returns the artifact card to the battlefield.""","1","1","0","USD","17cd920a-de09-454a-a9da-c84512e3aff1","166822","(cm2)","[cm2]","0","1"
"Feldon of the Third Path","Feldon of the Third Path","Johira","Commander 2014","C14","35","US$ 3.00","3","","1x","","","","M","Legendary Creature — Human Artificer","3","{1}{R}{R}","""• The token copies exactly what was printed on the original creature card (except that the copy is also an artifact) and nothing else.
• If the copied creature card has {X} in its mana cost, X is 0.
• Any enters-the-battlefield abilities of the copied creature card will trigger when the token enters the battlefield. Any “as [this permanent] enters the battlefield” or “[this permanent] enters the battlefield with” abilities of the copied creature card will also work.
• If another creature becomes a copy of, or enters the battlefield as a copy of, the token, that creature will copy the creature card the token is copying, except it will also be an artifact. This is true even if the creature card that was copied by Feldon of the Third Path is no longer in the graveyard at that time. However, the new copy won’t gain haste and you won’t sacrifice it at the beginning of the next end step.
• If Feldon’s ability creates multiple tokens due to a replacement effect (such as the one Doubling Season creates), each of those tokens will gain haste and you’ll sacrifice each of them.""","389515","""{2}{R}, {T}: Create a token that's a copy of target creature card in your graveyard, except it's an artifact in addition to its other types. It gains haste. Sacrifice it at the beginning of the next end step.""","2","3","0","USD","4c174e92-bc2a-42ba-9ce7-8c9fdf0a27f0","94094","(c14)","[c14]","0","1"
"Saheeli's Directive","Saheeli's Directive","Johira","Commander 2018","C18","26","US$ 0.79","0.79","","1x","","","","R","Sorcery","3","{X}{R}{R}{R}","""• Saheeli’s Directive considers the individual converted mana costs of the artifact cards you reveal. The sum of their converted mana costs may be greater than X.
• If a card in your library has {X} in its mana cost, X is considered to be 0.
• All of the artifacts put onto the battlefield this way enter at the same time. If any have triggered abilities that trigger on something else entering the battlefield, they’ll see each other.
• Improvise doesn’t change a spell’s mana cost or converted mana cost.
• When calculating a spell’s total cost, include any alternative costs, additional costs, or anything else that increases or reduces the cost to cast the spell. Improvise applies after the total cost is calculated.
• Improvise can’t pay for {W}, {U}, {B}, {R}, {G}, or {C} mana symbols in a spell’s total cost.
• Improvise can’t be used to pay for anything other than the cost of casting the spell. For example, it can’t be used during the resolution of an ability that says “Counter target spell unless its controller pays {3}.”
• If an artifact you control has a mana ability with {T} in the cost, activating that ability while casting a spell with improvise will result in the artifact being tapped when you pay the spell’s costs. You won’t be able to tap it again for improvise. Similarly, if you sacrifice an artifact to activate a mana ability while casting a spell with improvise, that artifact won’t be on the battlefield when you pay the spell’s costs, so you won’t be able to tap it for improvise.
• Tapping an artifact won’t cause its abilities to stop applying unless those abilities say so.
• Equipment attached to a creature doesn’t become tapped when that creature becomes tapped, and tapping that Equipment doesn’t cause the creature to become tapped.
• When using improvise to cast a spell with {X} in its mana cost, first choose the value for X. That choice, plus any cost increases or decreases, will determine the spell’s total cost. Then you can tap artifacts you control to help pay that cost. For example, if you cast Saheeli’s Directive and choose X to be 3, the total cost is {3}{R}{R}{R}. If you tap two artifacts, you’ll have to pay {1}{R}{R}{R}.""","450627","""Improvise (Each artifact you tap after you're done activating mana abilities pays for {1}.)
Reveal the top X cards of your library. You may put any number of artifact cards with converted mana cost X or less from among them onto the battlefield. Then put all cards revealed this way that weren't put onto the battlefield into your graveyard.""","0","0","0","USD","494c32ef-6fce-4330-9e34-a68497ae865e","170802","(c18)","[c18]","0","1"
"Ruins of Oran-Rief","Ruins of Oran-Rief","Johira","Oath of the Gatewatch","OGW","176","US$ 0.45","0.45","","1x","","","","R","Land","0","","""• The target of the last ability didn’t necessarily have to be a colorless creature as it entered the battlefield, provided it entered the battlefield during that turn. However, it does have to be a colorless creature to be a legal target of the ability.""","407686","""Ruins of Oran-Rief enters the battlefield tapped.
{T}: Add {C}. ({C} represents colorless mana.)
{T}: Put a +1/+1 counter on target colorless creature that entered the battlefield this turn.""","0","0","0","USD","9fed86e5-5631-401b-8820-9685f8296134","110744","(ogw)","[ogw]","0","1"
"Mountain","Mountain","Johira","Battle for Zendikar","BFZ","268","US$ 2.29","6.87","Foil","3x","","","","C","Basic Land — Mountain","0","","""""","401961","""({T}: Add {R}.)""","0","0","0","USD","11c94acd-ad60-4aec-b11b-f4dc4a9adfbc","104399","(bfz)","[bfz]","1","3"
"Wandering Fumarole","Wandering Fumarole","Johira","Oath of the Gatewatch","OGW","182","US$ 1.12","1.12","","1x","","","","R","Land","0","","""• Effects that switch power and toughness apply after all other effects that change power and/or toughness, regardless of which effect was created first.
• Switching a creature’s power and toughness twice (or any even number of times) effectively returns the creature to the power and toughness it had before any switches.
• A land that becomes a creature may be affected by “summoning sickness.” You can’t attack with it or use any of its {T} abilities (including its mana abilities) unless it began your most recent turn on the battlefield under your control. Note that summoning sickness cares about when that permanent came under your control, not when it became a creature nor when it entered the battlefield.
• This land is colorless until the last ability gives it colors.
• When a land becomes a creature, that doesn’t count as having a creature enter the battlefield. The permanent was already on the battlefield; it only changed its types. Abilities that trigger whenever a creature enters the battlefield won’t trigger.
• An ability that turns a land into a creature also sets that creature’s power and toughness. If the land was already a creature (for example, if it was the target of a spell with awaken), this will overwrite the previous effect that set its power and toughness. Effects that modify its power or toughness will continue to apply no matter when they started to take effect. The same is true for counters that change its power or toughness (such as +1/+1 counters) and effects that switch its power and toughness. For example, if Wandering Fumarole has been made a 0/0 creature with three +1/+1 counters on it, activating its last ability will turn it into a 4/7 creature that’s still a land.""","407692","""Wandering Fumarole enters the battlefield tapped.
{T}: Add {U} or {R}.
{2}{U}{R}: Until end of turn, Wandering Fumarole becomes a 1/4 blue and red Elemental creature with ""{0}: Switch this creature's power and toughness until end of turn."" It's still a land.""","0","0","0","USD","dd0ee251-6c79-499b-8366-c281c989b061","110820","(ogw)","[ogw]","0","1"
"Daretti, Scrap Savant","Daretti, Scrap Savant","Johira","Commander 2014","C14","33","US$ 3.27","3.27","","1x","","","","M","Legendary Planeswalker — Daretti","4","{3}{R}","""• You may choose to discard zero cards as the first ability resolves. In that case, you won’t draw any cards.
• You choose which artifact to sacrifice as the second ability resolves. You must sacrifice an artifact if you control at least one at that time. For example, if you control two artifacts when you activate the second ability, but the artifact you intended to sacrifice is destroyed in response, you must sacrifice the other artifact as the ability resolves.
• The ability of Daretti’s emblem will return the artifact card only if it’s still in your graveyard when the delayed triggered ability resolves at the beginning of the next end step. If the artifact card left your graveyard before that point (even if it was put back into your graveyard), the ability won’t return it to the battlefield.""","389478","""+2: Discard up to two cards, then draw that many cards.
−2: Sacrifice an artifact. If you do, return target artifact card from your graveyard to the battlefield.
−10: You get an emblem with ""Whenever an artifact is put into your graveyard from the battlefield, return that card to the battlefield at the beginning of the next end step.""
Daretti, Scrap Savant can be your commander.""","0","0","3","USD","cda40e31-ba99-4565-ad92-7c687ff44bd9","94170","(c14)","[c14]","0","1"
"Faerie Artisans","Faerie Artisans","Johira","Commander 2016","C16","8","US$ 7.31","7.31","","1x","","","","R","Creature — Faerie Artificer","4","{3}{U}","""• If you control multiple Faerie Artisans, each one’s ability only exiles tokens created with the ability of that specific Faerie Artisans.
• The token copies exactly what was printed on the original permanent and nothing else (unless that permanent is copying something else; see below). It doesn’t copy whether that permanent is tapped or untapped, whether it has any counters on it or Auras and Equipment attached to it, or any non-copy effects that have changed its power, toughness, types, color, or so on.
• The token is an artifact in addition to its other types. This is a copiable value of the token that other effects may copy.
• If the copied permanent has {X} in its mana cost, X is considered to be 0.
• If the copied permanent is copying something else (for example, if the copied creature is a Clone), then the token enters the battlefield as whatever that permanent copied.
• If the permanent copied by the token had any “when [this permanent] enters the battlefield” abilities, then the token also has those abilities and will trigger them when it’s created. Similarly, any “as [this permanent] enters the battlefield” or “[this permanent] enters the battlefield with” abilities that the token has copied will also work.
• A token creature that’s a copy of a player’s commander isn’t a commander.""","420625","""Flying
Whenever a nontoken creature enters the battlefield under an opponent's control, create a token that's a copy of that creature except it's an artifact in addition to its other types. Then exile all other tokens created with Faerie Artisans.""","2","2","0","USD","ff05c503-2536-48f5-a639-480614a2e5f8","124194","(c16)","[c16]","0","1"
"Urza, Lord High Artificer","Urza, Lord High Artificer","Johira","Modern Horizons","MH1","75","US$ 45.78","45.78","","1x","","","","M","Legendary Creature — Human Artificer","4","{2}{U}{U}","""• Urza’s last ability doesn’t change when you can play the exiled card. For example, if you exile a sorcery card, you can cast it only during your main phase when the stack is empty. If you exile a land card, you can play it only during your main phase and only if you have an available land play remaining.
• If a spell has {X} in its mana cost, you must choose 0 as the value of X when casting it without paying its mana cost.
• The token created by Urza’s first ability will count itself, so it’ll be at least 1/1.
• You can tap any untapped artifact you control, including an artifact creature you haven’t controlled continuously since the beginning of your most recent turn, to pay the cost of Urza’s mana ability. Tapping an Equipment this way won’t affect its abilities or the equipped creature.
• If you don’t play the card exiled with Urza’s last ability, it remains in exile.
• If you cast a card “without paying its mana cost,” you can’t choose to cast it for any alternative costs. You can, however, pay additional costs. If the card has any mandatory additional costs (such as that of Lesser Masticore), you must pay those to cast the card.""","464024","""When Urza, Lord High Artificer enters the battlefield, create a 0/0 colorless Construct artifact creature token with ""This creature gets +1/+1 for each artifact you control.""
Tap an untapped artifact you control: Add {U}.
{5}: Shuffle your library, then exile the top card. Until end of turn, you may play that card without paying its mana cost.""","1","4","0","USD","9e7fb3c0-5159-4d1f-8490-ce4c9a60f567","190836","(mh1)","[mh1]","0","1"
"Trinket Mage","Trinket Mage","Johira","Duel Decks: Elspeth vs. Tezzeret","DDF","49","US$ 0.32","0.32","","1x","","","","C","Creature — Human Wizard","3","{2}{U}","""• If the mana cost of a card in your library includes {X}, X is considered to be 0.""","222746","""When Trinket Mage enters the battlefield, you may search your library for an artifact card with converted mana cost 1 or less, reveal that card, and put it into your hand. If you do, shuffle your library.""","2","2","0","USD","fe522d2e-5f0a-40e3-98d2-b244226c2b03","36985","(ddf)","[ddf]","0","1"
"Ugin, the Ineffable","Ugin, the Ineffable","Johira","War of the Spark","WAR","2","US$ 4.59","4.59","","1x","","","","R","Legendary Planeswalker — Ugin","6","{6}","""• To determine the total cost of a spell, start with the mana cost or alternative cost you’re paying, add any cost increases, then apply any cost reductions (such as that of Ugin). The converted mana cost of the spell remains unchanged, no matter what the total cost to cast it was.
• A colorless spell whose mana cost is {2} or {1} will cost {0} to cast.
• Once you look at the exiled face-down card once, you may look at it again any time you wish. If another player gains control of the Spirit token, that player can’t look at the exiled card.
• If the Spirit leaves the battlefield for any reason, you’ll put the exiled card into your hand, even if Ugin left the battlefield before that happened.
• If you’ve activated Ugin’s ability multiple times, you must keep track of which exiled card belongs to each Spirit token.
• If an effect such as that of Doubling Season causes Ugin to create two Spirit tokens, you still only exile one card from your library. You’ll put that card into your hand the first time that either of the tokens leaves the battlefield.
• A land normally has no color, even if it can produce one or more colors of mana.""","460929","""Colorless spells you cast cost {2} less to cast.
+1: Exile the top card of your library face down and look at it. Create a 2/2 colorless Spirit creature token. When that token leaves the battlefield, put the exiled card into your hand.
−3: Destroy target permanent that's one or more colors.""","0","0","4","USD","7b003521-3da3-41bf-9765-36630653f902","188862","(war)","[war]","0","1"
"Izzet Boilerworks","Izzet Boilerworks","Johira","Commander 2016","C16","302","US$ 0.30","0.3","","1x","","","","U","Land","0","","""• If this land enters the battlefield and you control no other lands, its ability will force you to return it to your hand.""","420919","""Izzet Boilerworks enters the battlefield tapped.
When Izzet Boilerworks enters the battlefield, return a land you control to its owner's hand.
{T}: Add {U}{R}.""","0","0","0","USD","62b101ed-ab98-4f56-bcf1-e4e357ab7e18","124545","(c16)","[c16]","0","1"
"Ancient Tomb","Ancient Tomb","Johira","Ultimate Masters","UMA","236","US$ 25.00","25","","1x","Proxy","","","R","Land","0","","""""","456832","""{T}: Add {C}{C}. Ancient Tomb deals 2 damage to you.""","0","0","0","USD","bd3d4b4b-cf31-4f89-8140-9650edb03c7b","179473","(uma)","[uma]","0","1"
"Muzzio, Visionary Architect","Muzzio, Visionary Architect","Johira","Conspiracy","CNS","23","US$ 3.59","3.59","","1x","","","","M","Legendary Creature — Human Artificer","3","{1}{U}{U}","""• The value of X is determined as the ability resolves. If, at that time, you control no artifacts, you won’t look at any cards.""","382314","""{3}{U}, {T}: Look at the top X cards of your library, where X is the highest converted mana cost among artifacts you control. You may reveal an artifact card from among them and put it onto the battlefield. Put the rest on the bottom of your library in any order.""","1","3","0","USD","170926b9-4bfa-4a9b-a297-db1672bc48d9","82900","(cns)","[cns]","0","1"
"The Antiquities War","The Antiquities War","Johira","Dominaria","DOM","42","US$ 0.50","0.5","","1x","","","","R","Enchantment — Saga","4","{3}{U}","""• The final chapter ability of The Antiquities War affects only artifacts you control at the time it resolves. Artifacts you begin to control later in the turn won’t become 5/5 creatures.
• The final chapter ability of The Antiquities War overwrites an artifact creature’s normal base power and toughness and all previous effects that set an artifact creature’s base power and toughness to specific values. Any power- or toughness-setting effects that start to apply after the ability resolves will overwrite this effect.
• Effects that modify an artifact creature’s power and/or toughness, such as the effect of Titanic Growth, will apply to the creature no matter when they started to take effect. The same is true for any counters that change its power and/or toughness and effects that switch its power and toughness.
• If The Antiquities War somehow becomes an artifact enchantment prior to resolving its final chapter ability, it will become a 5/5 Saga artifact enchantment creature, and will then be sacrificed after that ability resolves.
• An Equipment that becomes an artifact creature becomes unattached if it’s attached to a creature. Its equip ability can be activated, but it won’t become attached to the target creature.
• As a Saga enters the battlefield, its controller puts a lore counter on it. As your precombat main phase begins (immediately after your draw step), you put another lore counter on each Saga you control. Putting a lore counter on a Saga in either of these ways doesn’t use the stack.
• Each symbol on the left of a Saga’s text box represents a chapter ability. A chapter ability is a triggered ability that triggers when a lore counter that is put on the Saga causes the number of lore counters on the Saga to become equal to or greater than the ability’s chapter number. Chapter abilities are put onto the stack and may be responded to.
• A chapter ability doesn’t trigger if a lore counter is put on a Saga that already had a number of lore counters greater than or equal to that chapter’s number. For example, the third lore counter put on a Saga causes the III chapter ability to trigger, but I and II won’t trigger again.
• Once a chapter ability has triggered, the ability on the stack won’t be affected if the Saga gains or loses counters, or if it leaves the battlefield.
• If multiple chapter abilities trigger at the same time, their controller puts them on the stack in any order. If any of them require targets, those targets are chosen as you put the abilities on the stack, before any of those abilities resolve.
• If counters are removed from a Saga, the appropriate chapter abilities will trigger again when the Saga receives lore counters. Removing lore counters won’t cause a previous chapter ability to trigger.
• Once the number of lore counters on a Saga is greater than or equal to the greatest number among its chapter abilities—in the Dominaria set, this is always three—the Saga’s controller sacrifices it as soon as its chapter ability has left the stack, most likely by resolving or being countered. This state-based action doesn’t use the stack.""","442930","""(As this Saga enters and after your draw step, add a lore counter. Sacrifice after III.)
I, II — Look at the top five cards of your library. You may reveal an artifact card from among them and put it into your hand. Put the rest on the bottom of your library in a random order.
III — Artifacts you control become artifact creatures with base power and toughness 5/5 until end of turn.""","0","0","0","USD","bbda670a-00a7-419c-b4b5-bfdb323f006d","162240","(dom)","[dom]","0","1"
"Slobad, Goblin Tinkerer","Slobad, Goblin Tinkerer","Johira","Darksteel","DST","69","US$ 0.69","0.69","","1x","","","","R","Legendary Creature — Goblin Artificer","2","{1}{R}","""• Damage wears off simultaneously with this effect ending, so it does save an artifact creature from lethal damage.""","51055","""Sacrifice an artifact: Target artifact gains indestructible until end of turn.""","1","2","0","USD","df14aa0e-6d34-48ca-aee0-3563bbfb3b15","11716","(dst)","[dst]","0","1"
